{
  "name": "inst_shift_arithmetic_right_imm",
  "initial-regs": [
    0,
    0,
    0,
    0,
    0,
    0,
    0,
    2147483765,
    0,
    0,
    0,
    0,
    0
  ],
  "initial-pc": 0,
  "code": [
    0,
    0,
    3,
    25,
    121,
    3,
    249
  ],
  "expected-status": "trap",
  "expected-regs": [
    0,
    0,
    0,
    0,
    0,
    0,
    0,
    2147483765,
    0,
    4026531854,
    0,
    0,
    0
  ],
  "expected-pc": 3
}