{
  "name": "inst_xor",
  "initial-regs": [
    0,
    0,
    0,
    0,
    0,
    0,
    0,
    5,
    3,
    0,
    0,
    0,
    0
  ],
  "code": [
    0,
    0,
    3,
    28,
    121,
    8,
    249
  ],
  "expected-status": "trap",
  "expected-regs": [
    0,
    0,
    0,
    0,
    0,
    0,
    0,
    5,
    3,
    6,
    0,
    0,
    0
  ]
}